{
  "$schema": "https://json-schema.org/draft/2020-12/schema",
  "$id": "https://raw.githubusercontent.com/travisjneuman/travisjneuman/main/showcase/schema/showcase-v1.json",
  "title": "Showcase facts (v1)",
  "description": "Public facts about one project, owned by that project's repo (or showcase/private/ for private projects). Consumed by scripts/showcase/sync-showcase.mjs.",
  "type": "object",
  "required": ["id", "name", "status", "summary", "visibility", "links", "stack", "metrics", "updated"],
  "additionalProperties": false,
  "properties": {
    "$schema": { "type": "string" },
    "id": { "type": "string", "pattern": "^[a-z0-9-]+$", "description": "Matches the tjn.portfolio project id" },
    "name": { "type": "string" },
    "status": { "enum": ["live", "active", "development", "paused", "maintained", "retired"] },
    "statusNote": { "type": ["string", "null"], "description": "Short qualifier, e.g. \"Auto-posting paused\"" },
    "summary": { "type": "string", "maxLength": 220 },
    "visibility": { "enum": ["public", "private"] },
    "links": {
      "type": "object",
      "additionalProperties": false,
      "properties": {
        "live": { "type": "string", "format": "uri" },
        "repo": { "type": "string", "format": "uri" }
      }
    },
    "stack": { "type": "array", "items": { "type": "string" }, "minItems": 1 },
    "metrics": {
      "type": "array",
      "minItems": 1,
      "items": {
        "type": "object",
        "required": ["value", "label", "source", "round", "asOf"],
        "additionalProperties": false,
        "properties": {
          "value": { "type": "string" },
          "label": { "type": "string" },
          "source": { "type": "string", "description": "Command (or 'manual: ...' note) that measures the value" },
          "round": { "enum": ["exact", "floor-2sig"] },
          "asOf": { "type": "string", "format": "date" }
        }
      }
    },
    "updated": { "type": "string", "format": "date" }
  }
}
